,id,date,date_y,date_m,date_d,username,rating,content
0,0,20210901,2021,9,1,맑은강물,1,"핸폰바꿔서 다시 시작하는데 휴대폰인증 단계에서 인증번호요청 그게 안됩니다. 몇번이고 다시 깔고 다시 하고,그래도 인증번호 문자가 안와요 모든 금융권 모든 인증번호필요한 어플 중 유일하게 여기!신한만 안되요 여기만! 이게 고급기술도 아니고!!"
1,1,20210827,2021,8,27,김미룡시,1,업데이트 공지 보고 설정에 구글플레이스토어 캐시및데이터 삭제하고 재설치하고 마지막 인증 선택시 지문등록이 안됩니다 3번이나 시도했는데 먹통이네요 ㅡㅡ 그리고 삼성페이 결제 진행했는데 먹통이 되서 그런지는 몰라도 결제지문도 없어지고 핸드폰 재부팅하니 제대로 작동하네요 ㅡㅡ
2,2,20210902,2021,9,2,김태환,1,가끔 어플 켜지도 않았었는데 접속하면 지문인식 5회 실패라고 뜹니다 이거 너무 불편합니다. 필요할 때 이러니까 사용하는데 지장이 있네요 수정 부탁드리겠습니다. 일부러 일정 시간마다 이렇게 되도록 해놓은건지 모르겠는데 꽤 자주 이러네요..
3,3,20210829,2021,8,29,aAAa 1,1,아니...폰바꾸고 지문등록하고 잘들어가졌는데 지문추가해서 지문재등록하라고 뜬뒤로 안들어가져요ㅡㅡ 왜자꾸 OTP타령인지..지문이고 뭐고 다른방법으로 들어가려고해도 기승전OTP임.. OTP무조건써야하나요..?쓰기시른데 울화통터짐...
4,4,20210829,2021,8,29,문치르,1,공동인증서 로그인하려니 폐기된 인증서라함. 다시 인증서 받아오려니 이미 유효한 인증서 있다고함. 다시 로그인하려니 폐기됐다고함. 그냥 아이디로그인 그것도 안됨 개같은어플진짜
5,5,20210831,2021,8,31,주말둥둥,1,"진짜 앱 평가 처음 남겨봄 1. 업데이트할때마다 최적화를 망치는 기술이 있는지 갈수록 느려지기만하는 기술 2. 업데이트시 전면 퀵메뉴를 멋대로 바꾸는(바뀐 아이콘은 대출/카드상담 등 진짜 할말이 없게나오는 수준) 중국앱도 안하는 자유박탈정책 3. BM이 나올수 있는건 죄다 앱에 추가하면서 늘어가는 용량, 떨어지는 사용성 절이 싫으면 중이 떠나야지. 월급통장 옮기고 카뱅으로 넘어갈거임"
6,6,20210902,2021,9,2,김송이,3,"느려요 오픈뱅킹 타행계좌는 다른 메뉴에서 따로 볼수있게 업데이트 해주세요 신한은행계좌(입출금, 적금, 대출)는 한번에 보고싶어요."
7,7,20210907,2021,9,7,윤성렬,4,저기 조회에 한도조회없고 이체에 이체한도늘리기가 없고 모바일OTP인증에 ARS는 되믕서 신분증인증는 안되는데 중증장애인등 요즘 코시국에 아니 이제 대세는 온라인 뱅킹인데 이렇게 인증장치 잘해놓고 앱으로 한도조절 못하게막음 니가와 플레이하는거아니시죠?🤔
8,8,20210911,2021,9,11,eavan wittgenstein,2,로딩에러가 많이 발생하는데 원인을 알 수 없으니 굉장히 불만을 불러일으키네요.. 금융회사라면 사용에 신경써야 될껀데 많이 기피하게 될거 같네요.