,id,date,date_year,date_month,date_day,rating,user_name,content
564,565,2022-08-06,2022,08,06,3,Ice Bear,Would've given it 5 stars if mobile wasn't to broken. Sometimes (and for no reason) my camera just doesn't move anymore it just zooms in and out. Another thing is the controls sometimes when I'm playing with the dynamic thumb stick it thinks im moving the camera when I'm not. So when I try to move it puts my camera down.
565,566,2022-08-05,2022,08,05,4,Tegan Cuffe,Great game and an excellent selection of games!the reason why I gave this 4 stars because it's glitches sometimes and it logs me out of my account and it's quiet hard to remember my password! I hope u can fix this glitch. it also disconnects me from games for no reason but I don't mind that! Overall I adore this game!!!
566,567,2022-08-01,2022,08,01,3,Lucy Boyle,"It's now 2022 and my account has been shut for a whole year due to it being hacked then banned, i would rate it 3 stars as the customer service was terrible, whilst speaking to them via email about had happened to my account i was talking to a robot the whole time and the issue could not be resolved. I had spent so much money on robux and had very good items on games."
567,568,2022-08-03,2022,08,03,5,CD Playz,"I like this game and it is great and detailed but there are a few minkr issues, sometimes when I say a number or letter is turns into a tag. Some people also dont have access to robux to maybe make like a daily quest system so when you complete a quest in a game, you get 30-50 robux. But overall its a great game."
568,569,2022-07-29,2022,07,29,5,Sawyer Schindelka,It's a really fun game and there are a lot of games! The new 3D clothing made it really hard for me to find classic clothing when searching stuff up but I still found them. I really like the game and I love how you can create your own avatar for free and with robux!
569,570,2022-08-12,2022,08,12,4,Niharika,"Hello I've been playing roblox for a while and it's actually pretty good, I'm on PC so I think it's makes sense that it's good but there's a small problem, and that is remove tags from only bad words cause it's making it hard to communicate with other people how am I supposed to go to Google and find a synonym just to try and communicate, that's a waste of time, and can you like add an update like when someone speaks a different language you can translate it to what you like. thanks"
570,571,2022-08-07,2022,08,07,4,Rachael Slusser,"Honestly.i really like it as there is over 1000 games on here in one and I find the concept of making your own avatars entertaining sure it has its bad sides but I really like the idea.Over all great game 10/10 would recommend to anyone with a kid, but there might be bad people who can talk to you so I recommend friending only people you know, and setting you chat settings to only friends can talk to you"
571,572,2022-07-30,2022,07,30,4,Poppy Flynn,"This game eats up my free time. The graphics are amazing and are obviously at the max. I definitely recommend if Ur bored. The only thing about it is you have to pay for robux , I don't think u should have to pay as a starter because then I can edit Ur avatar as how u want it. But that's all roblox needs to change. It's a brilliant game and could play all day. The selection of games are massive and really fun I enjoy all of them . And the amount of people play it are unreal. Get it now ✓"
572,573,2022-08-13,2022,08,13,3,Haikal Daffa,"I quite like this game, but the stuff here is very expensive I also don't know how to get robux. This game has a few drawbacks, which is very fragile if the WI-FI is just a little shaken Immediately the severe lag is really annoying me entering it too sometimes takes quite a long time it's very annoying I hope it can be fixed quickly......"
573,574,2022-08-06,2022,08,06,4,Madison Hansen,"This game is so fun! This game would be way better if these things didnt bother me... For example, I ALWAYS lag, and my game crashes a lot! And yes, this game is huge so its going to lag, but I lag so much. There are some other small bugs, but they are too important. I just wanted to share with u what i think about this game"
574,575,2022-08-20,2022,08,20,4,Susan De Jesus,This is game is amazing and here is a list of things that i like: you can be anythign you can imagine and theres so many games with so many fun things to do my personal favorite games are bedwars and tower heros but the reason i didnt rate the game 5 stars is because when i go to settings (game settings) when i go out of it some times it changes my screen other then that issue the game is one of the best games ever
575,576,2022-08-17,2022,08,17,5,Sothy Tauch,"This game was really fun I grew up with it even my older sister plays it a lot but there's this glitch I don't really like... Well, sometimes you can move the joystick but its also moving the screen. And when I call my best friend, she gets this glitch where you play 3008 and you go afk for a few minutes then you come back and now your screen is stuck. So thats all I wanted to say!"
576,577,2022-07-29,2022,07,29,4,Stacey Cerminaro,I dont like it too many scammers i got scammed 7 times all different ways.Other than that its pretty cool. Very nice games. But very glichy. Other than any of those. Its great! 😀 But the sir is one thing keeping me from giving this 5 stars. The moderation needs to be improved a lot.
577,578,2022-08-03,2022,08,03,3,Mandi Moore,It's a great game! But it lags really bad....ಠ_ಠ.....it'll not let me walk and it'll move the screen by itself to. And on royal high it'll lag even worse . (I do recommend it great game ) it could be what I'm on but if not if you could take a look and fix that would be great. Thank you.:-) that's why I gave three star
578,579,2022-08-04,2022,08,04,5,brookie_ cookie96,"Sometimes when i join certain games, like natural disaster, it turns my phone screen normal like when i first join the app, or like when im on instagram or tiktok. instead of like when im in a game or when im watching youtube. also sometimes when i join other certain games, which i cant remember the names of, i wont let me move. i can move the joystick, but not my actual avatar. other than these problems, i love this app and would give it a 10/10!!!!!!!!!!!!!!!!!!!!!!!!!!!!!!!!!!!!!!!!!!!!!!!!!"
579,580,2022-08-16,2022,08,16,4,Hyro Playz,"The game is great! It has everything Adventures, Actions, Roleplay, Shooter, and more. But after playing for enough time everytime i play something like afs (anime fighting simulator) it just crashes... Its definitely something that MUST be fixed since it ruins the game alot."
580,581,2022-08-02,2022,08,02,3,Zøë Geørge,"Very disappointed , they deleted the most nostalgic part of the game, the oof sound. They replaced it with a 'duh' sound. Very annoyed. Infact, everyone across the platform is in despair over this enormous loss."
581,582,2022-08-02,2022,08,02,5,Cassidy Parker,"Now, don't get me wrong.Playing this game on a chromebook is TERRIBLE, and the lag is worthy of Zeus. However, I find every minute(That I'm not disconnected)amazing in every possible way. If you don't like a certain game? Well, there's millions more to choose from! This is a game I'll play for a long time to come, and I'd like to see another game try to top it. Something tells me Roblox is going to be the first on the list of top games for a very long time, and I'll always have a reason to play."
582,583,2022-07-29,2022,07,29,5,Payton Peddy,"Perfect, amazing, and one of the best games I have ever played. My favortie has to be Brookhaven or maybe Adopt Me. Tycoon's are fun to, but as much as Brookhaven is. Brookhaven is like a real world but in a game. I think it is based off of the real town, Brookhaven, Pensillvaina. (I think thats how you spell it)"
583,584,2022-08-17,2022,08,17,2,Scotty Crawford,I got banned for a day for no reason. My friend logged me out and asked if I wanted to play on their account when I showed them. I said no thanks and went to sign back into my account. My password wasn't working. I checked several times and it was right. I went to change my password but it isn't sending me a verification code. Just lost my account with everything on it. Including birthday money I spent on it and things I really loved.
584,585,2022-08-03,2022,08,03,4,Maria Ramirez,It's a three star because it is a very fun game but there are a lot of issues. If u lose access to ur account then you probably wouldn't get it back. And the chat filter is so bad you can say a lot of bad stuff but can't say some words that are not bad at all. It makes no sense. But it is pretty fun and I have a lot of nostalgia from Roblox.
585,586,2022-08-14,2022,08,14,3,Jason Pennington,I like this game alot but there is a couple of problems with it like the tags and there are some bugs with it to like i can only zoom in and out and can't walk and the only way I could fix it was to leave I would rate it higher but those problems are stopping me from doing that so I hope you fix them soon!
586,587,2022-08-13,2022,08,13,4,Riley Woods,"This Game Is good has some glitches in some of the games but most of the time its fine. Once i wanted to plug in my head phones in to my computer on Wolfs Life 3 and it worked on any other app but when i plugged them in on only that game there was no sound then i got of of roblox and it wouldent play any music,nothing so i just stopped and my parents had to deal with it..."
587,588,2022-08-05,2022,08,05,4,Gabe,"Great game, as the whole world knows. My only complaint is robux. Can you make them not only buyable. But also earned through finishing goals. Like finshing 15 Obbys, or making friends w/ 200 players. My problem is not only the robux. Another would be all the bugs! Sometimes the cameras movement acts up and I can't move it around, only in and out. Also, sometimes my wifi will go down a single bar and BOOM kicked out. In conclusion, the game's alright for fun times w/ friends If on strong WiFi"
588,589,2022-08-08,2022,08,08,2,enixampuffs 128,"I am paying for a private server for Bee Swarm Simulator, but it has a lot of issues. Today it's telling me that I'm not allowed to join the experience, I would really like to able to to access my game!💔😭 EDIT: today is a new day and I had to renew my server even though I wasn't able to access it for the entire day before it expired... and NOW it keeps booting me. My internet connection is fine, not sure why it keeps happening?? I just want to play what I pay for!! Sheeshh!!"
589,590,2022-07-29,2022,07,29,4,christina loughton,"overall, roblox is a great game! i play it nearly everyday, whether im playing on my tablet, xbox, or whatever i choose to play on. i love how theres so many different games to play and so many ways to change your avatar. but lately i've been having an issue, roblox keeps telling me that i need to update, i cant even make it to my home screen and it sends me directly to the playstore, but it tells me that the installation was unsuccessful. is anyone else having this problem??"
590,591,2022-07-29,2022,07,29,3,Muhammad Danish,"On mobile devices it keep kick you out of the game when it frame drop, even a little bit of frame drop it kick out for no reason, please fix, it keeps saying launching experience, but i wait for an hour for nothing in there just a waste of time, please fix this... I just wanted to play my old childhood game... On mobile it's bad, Pc is better but sadly i don't have a good pc"
591,592,2022-08-08,2022,08,08,5,milton banegas,"Over the years, this game has improved itself to make the experience better for everyone and it has. There's thousands of games to choose from, you can change your avater whenever you want, and new items always come into the game. In ROBLOX, you get to buy robux with real money. Robuxs is money so you can dress up your avater. There are different genres in games in ROBLOX so you can have different experience. This game gets more fun every day you can really enjoy it."
592,593,2022-08-15,2022,08,15,4,Debrah Harbed,Love it but some games and if you want a good looking character you got to pay for it and I really don't like the have to do that I mean yeah you could at least put a little bit more options and then make a little bit they have to pay for but that's way too much so please try to make more options love you all 🥰☺️😊😔😫😂
593,594,2022-08-10,2022,08,10,4,Yara Playz,"Roblox was fun when I first started playing in 2016. There were alot of fun games that I enjoyed playing. Especially, Adopt Me. It was fun back then and so were all the other games. Especially without all the hacking and scamming. Now, Roblox is very boring. I stopped playing my favorite game, Adopt Me. Because of all the scamming and hacking. And not just Adopt Me. Many other games aswell."
594,595,2022-07-29,2022,07,29,4,Your_Local_Therapist AYYY,"This game is amazing , the games are great and I've played it since I was 6-7. But the Robux are overly expensive and sometimes i wish that you can earn them from playing games or selling clothing. Another problem is I've tried to play roblox on my computer and it lags NON stop. Even if I update it or sign out. Another problem is , I would try to play a game I like on another device and it won't let me and it limits my options. Which overly upsets me. And the tags.Oml."
595,596,2022-07-29,2022,07,29,5,Gia Perez,"This is truly an amazing app, it like Thousands of games in 1...Aside from all the losing friends and fights..I love it! I lag A lot but its not the game's fault so I give it a five star rating because it has earned it, the only thing I don't really like is that you try saying something then it just says ""###########"" sometimes so it makes me a bit embarrassed so something Im trying to ask is if you can make the games hide the tags, and I don't like how a lot of stuff cost over 3,000 BUT 5 STAR"
596,597,2022-08-03,2022,08,03,4,Sariyah McGillick,it's very fun and entertaining you can make friends play some games and much more! You can make outfits Buy items and lots of more stuff you can do. Play obbys building games dress up games fighting games lots more! But there is 1 rule NO ONLINE DATING!!! The reason why I gave it 4 stars is because I joined a game and it looked like everyone was typing spaces but I found out they weren't I couldnt put a name type in the chat ( it would come as a space ) I hoped this helped you byeeeeeeeeeeeeeee!
597,598,2022-08-06,2022,08,06,3,shaista marium mansuri,"This game is awesome. But, their is some problem in it .1. Sometimes i accidently got out and when i come in my character don't move and insted it zoom out .2. When i play parkour game , it got glich .Ex.My character jumping continuously, when i am not touching the screen. Please, Fix the glitches."
598,599,2022-08-21,2022,08,21,3,Annalisa Marie,game is very glitch-ie even with good inernet and made me have a kyle moment but with my device (i bit my phone and cracked the back) also sometimes the thing to see where u turn locks up and you'll have to leave and come back to the game u we're playing. (Also sometimes the joy sticks lock up but you only have to go to the menu) but the games are fun but some people are the worst
599,600,2022-08-03,2022,08,03,4,DarkYT,"Pretty good game, but the lag and the bugs is the one who is ruining the game, player being toxic, some bug's are the worse like in mobile when you tap too much in the game you get an screen bug that you can't rotate you're screen it only works for up an down, its the worst for mobile player's, there aren't mobile support, Some bug's are still in the game after 2y."
600,601,2022-08-16,2022,08,16,5,mubasher brohi,"Roblox is the best game I have ever played in my life I wanted to rate it a infinity stars but I can't because there are only 5 stars. I love this game. But somethings are very expensive and some faces and accessories are too expensive to buy not a fair price of skins and faces, characters also accessories as well as clothes."
601,602,2022-08-19,2022,08,19,5,Samantha Boggs,"Who would say no to a game like this? You can meet wonderful people and learn new things by playing various games, customize your own character and choose between thousands of games! The overall game and all it has to give, is a never ending journey, which is what I call, OUTSTANDING!"
602,603,2022-08-06,2022,08,06,5,WEGONNA BEPRO,"This is really cool! This is one of the most successful game I ever played!! It's so fun, you can chat with your friends or add some friends to your friends list, I also got robux and the game is really fun! There's billions of games waiting for us to play and u can change your avatar to what you like! Most of them cost robux.. But that's okay! You can customize your avatar with free items! That's all it was really fun playing roblox I played roblox for 3 years."
603,604,2022-08-01,2022,08,01,4,Kiji,"I think roblox is a great multi-player game but it has some downfall, there are a lot of outages and you may get disconnected frequently so it might mess up your game play. Other than that, most of the community is great and I recommend you play the game. There are a lot of games and features to choose from, you can make a lot of friends and create your own games, designs, etc. Roblox is a great multi-player game and you should download it."
604,605,2022-07-31,2022,07,31,4,Natia Kobaidze,"Great game however I wish they were better when mods sometimes. I've ocasionally been banned for things I didn't do or that weren't understood. There is also the fact that some of the things I had bought were removed and I wasn't compensated for them dispite spending robux on it. It's a prety great game. It's fun for all ages you just have to learn how to play! I hope this helps anyone considering to remove the game or buy it. 1 star down because they took the ""oof"" away and its not the same now"
605,606,2022-08-19,2022,08,19,4,Kaydin O'Reilly,"I love it. It don't have any adds and I can play this all day long. However... Sometimes when you go to leave and accidentally click that then you get outta it, it just goes crazy. Like I can't play the game. Because I'm on my phone I need Roblox to fix this. However, it keeps me focused while everyone else is doing something. But please fix this Roblox please. I beg you from heaven into darkness"
606,607,2022-08-02,2022,08,02,5,Dust Moon,"This is an amazing game! Ofcourse it will have some bugs, but they can be fixed in different ways. If you like games that constantly update to give you the best experience, this game is for you! (It only updates once or twice a moth. In my oppinion its not a bad thing.)"
607,608,2022-08-02,2022,08,02,5,William Finley,Simply amazing that this game I played and thoroughly enjoyed playing on the PC 15 years ago is now capable of being ran on a phone anywhere! Plus the cross platform nature of the game makes it possible to play seamlessly and effortlessly across different devices!
608,609,2022-08-03,2022,08,03,4,Brie Gurtler,"Although Roblox is a great game, there are some things that I would like fixed. One issue is with the layered clothing. It is glitchy on some games and sometimes isn't even on. Another thing is you can't create games and clothing on mobile. Many people don't have the option to create because they are only on mobile. The third thing that I would like changed is how you can only buy Robux. It would be nice if you could earn Robux on games too. Those are the issues and recommendations I have."
609,610,2022-08-12,2022,08,12,3,Vanessa Ann Ignacio,"This app is amazing! I always go in the app every day, i would rate this 5 stars but since there are problems 3 stars. 1st problem. I always have camera glitches and its getting annoying since i cant move my screen! Its really annoying when something really amazing happend but i get the camera glitch. 2nd problem. My clothes are always deleted and i cant get my robux back! I spent so much robux on my clothes just for it to get deleted. I really hate that! I really need my robux back!"
610,611,2022-07-29,2022,07,29,4,Cerelin Martinez,I'll be honest this game is amazing! I have so much entertainment! But there is a couple things. Some people in this game are toxic and mean and even hackers and scammers. On mobile devices your screen like you can't move for a bit. and it softlocks it's self so you can't move your cam and then you can't have control of your cam but this is for mobile. I hope they fix this in the future. But overall this is the most fun game ever!
611,612,2022-08-15,2022,08,15,4,Jai Kapoor,I give it a 4 star as it is a really fun game and I enjoy it a lot but I do not like how you got rid of the music and if you hadent done that I would have rated it a 5 star game. Another reason why I rated it as a 4 star game is that (most people will find THIS CRAZY ) there is TOO MANY UPDATES!!! Whenever I want to play I have to update and it takes AGES. if you made all these small updates into a big one once a month or so and I wouldn't waste time of playing this amazing game.
612,613,2022-08-04,2022,08,04,4,shyrie santayana,"The game is over all inanely amazing and cool. It is an online platform that allows you to play with friends and other Roblox Players. Why i rated this game 4 stars is because the game has a lot of bugs, glitches, hackers and so much more. I hope the the amazing developers of Roblox is working on it. And as a suggestion, try making a better way to connect with your account, its because I mostly get in trouble trying to log in to my account. Make a better sign up and log in system for the best!"
613,614,2022-07-29,2022,07,29,4,Ivan Atilano,Its a great game and I can play with my friends and it has a bunch of other games to but it lags some times for example the screen get stuck and went you try to move the cámara its zooms in and out. But I really recomend this game.
614,615,2022-08-21,2022,08,21,4,Hannah G,"I like the game and all, but the thing I hate about it is that my screen freezes, then kicks me out the game, your reports don't work either. Only for some games, maybe fix the reports and these glitches."
615,616,2022-08-09,2022,08,09,5,Sean Mishler,I've had a lot of fun with this game over the years. There were a few times where I got random communication errors out of the clear blue. The hashtags do get anoying sometimes but is a very great game and I recomend you play it.
616,617,2022-07-28,2022,07,28,4,Amelia Jackson,"I love playing the game with friends but however, I have glitches where when I look around it zooms in and out and having to rejoin, I recently got robux and bought classic shirts and two of my favorite shirts got deleted 1) a grunge skeleton hoodie 2) a white crop top. I also think things should be MUCH cheaper like super happy face, I think the limit amount of robux to sell it for should be about 100 or 200 robux leaving people to get much more things and look better."
617,618,2022-08-03,2022,08,03,4,Joseph Naut,"This is a fun app with so many games, BUT the problem is that you have to buy shirts, shoes, pants and etc to customize your character, I give it a four stars because it fun and all, but it's just the robux that makes it sad for people who can't afford it."
618,619,2022-08-08,2022,08,08,5,Prinz ombar Jubac,"This game is supper fun when you play with ur friends or by yourself, you can also make friends and play a lot of games, the problem here is we can't do hair combos on mobile or iPad it's only working on computer. So my suggestions here is can you please make the Mobile or iPad users to have a chance to make a hair combos cause it's only working on computers thank you!!"
619,620,2022-07-29,2022,07,29,4,Adam Sh,"This game is cool. But, i have one problem with it. When i am in a game and press the sttings button more than once, i cant move my screen 360° . I mean, when i want to lookat the right, my screen will zoom in and i have to leave and re-join to fix it and this is so annoying,so please if there is a way tell me how to fix and if not please fix it so that i can give you 5 stars ⭐⭐⭐⭐⭐ (android problem)"
620,621,2022-07-28,2022,07,28,4,Ken Laidlaw,"Personally, I find that the censership should be slightly less targeted, but overall it's a good game. Some games are very fun while others can be used as time passers. Resently, there was a feture removed that I used to use alot; typing the spacebar into the searchbar to see the most popular games at the time. I would like to see this and a few other fetures in the main game, but Over all, the Roblox experince is very dependent on the other players and the recemendations."
621,622,2022-08-02,2022,08,02,5,Morgan Sorlie,It is great! Although it can be really anoyng glichy umm if u play a game that says pic an outfit for free it is a scam and I am in a game and all the sudden it started suming In and out and there is more proploms I just can't think right now but otherwise it is a very calming nice caswal game and I recommend it for anyone!!!!!
622,623,2022-07-30,2022,07,30,5,Trxppii,"Very fun, addicting and engaging. Chat filters are a bit sensitive, but that just makes it even more safer for kids. Plenty of fun games to play and make friends with. It can be a bit laggy on phones, but it's still manageable."
623,624,2022-07-30,2022,07,30,4,Jayce Scott,I finally got my account back after it got hacked but I have some issues. Sometimes my camera will lock and when I try to look around it always zooms in and out. Another issue about the screen lock is sometime my camera will glitch out and when I try to move around my camera follows the direction my finger is going to move my character. These 2 glitches are ruining my gameplay. Please fix this as soon as possible roblox. Other than that this is a great game 😎👍
