,id,date,date_year,date_month,date_day,rating,user_name,content
0,1,2022-08-20,2022,08,20,5,iam_dejjee,"Great app. The only things I can complain about is the lag. It wasn't happening but all of a sudden I've become really laggy. Also it disconnects randomly me if my wifi status isn't all the way full or 1 bar away from being full. it only happens when I play the game, so I know it isn't my phone. My wifi will just randomly go off. You have no idea how difficult that makes it to play. Also my screen will sometimes freeze, and sometimes it'll lock too. Please fix it. I really like this game. Ty ❤️❤"
1,2,2022-08-01,2022,08,01,5,raesean collins,"This is a pretty cool app,I love how there different games, I really love simulators and more! And when I play I don't have any issues, it clear and great quality 👌. However sometimes the screen glitches and when you try to turn your screen it zoom in-out, and If you try to reset your character it doesn't work and you have to rejoin, but some if you wait it will Un glitch,but other than that no other problems."
2,3,2022-08-03,2022,08,03,4,Daelynn,"This game is fun, you could play with a bunch of friends, games, and more. I've been playing this game for years and I wanted to say a few things.. if you press the menu button and try moving the joystick, the joystick moves the screen. it's an annoying glitch and I'm pretty sure that it hasn't been patched yet. also, i would recommend adding an ""recommendation"" thingy so we could request what we want in roblox and also other people could see our suggestions!"
3,4,2022-08-19,2022,08,19,3,Ti,"Buggy but it's fun. The camera sometimes bugs out and either makes it impossible to turn or it does a lot of other weird inputs like turning when walking, other times games will randomly get confused and think you're playing on PC all of a sudden making it unplayable until you leave and join back (which can be frustrating when you're in the middle of something). It's alright though, nice to be able to play roblox, with chat, without a PC."
4,5,2022-08-22,2022,08,22,4,Deonna Perkins,"I love this game i play it all the time. my only issues right now is that I have upgrade it so many times and then I have to delete apps just to play the game and the joystick bugs out at the worst time when you are playing a game (like a horror game), and at times it will think you are on PC, also I would like to talk about how me and many other people keep gets ban for no reason it makes no sense."
5,6,2022-08-04,2022,08,04,5,A Google user,"This game has so many different kinds of genres such as Jailbreak, Adopt Me, and Brookhaven. And they're all super fun, definitely reccomend. Although there is 2 glitches with the camera, other than that the game is flawless. Glitch #1: When you go to the player list there's a big chance your screen with glitch out and you won't be able to play normal, your joystick is like you're zooming in and out, you can't move your screen and it's just horrible. Glitch #2: Your screen locks."
6,7,2022-08-22,2022,08,22,3,LpsUndead Pro,I love this game but the mobile version has really irritating issues. Sometimes my game crashes or freezes when I'm trying to work on my avatar and sometimes my camera breaks and all I can do is zoom in and out. This has been happening for at least a month and I'm getting sick of it. I hate having to rejoin games because of a stupid camera bug. Especially games that have timers and countdowns for things.
7,8,2022-08-21,2022,08,21,4,Your.Local.Hershey,"This is a good game overall, you can play with friends, costomize your character, and Robux is fairly cheep for a good amount. There are a few bugs tho. Your screen can get stuck on shift lock even if theres no option for it, sometimes it will glitch and not let you move your screen at all, resulting in you re-joining bc there's no other way to fix it. Which can be very annoying in unsavable obbys/tycoons and such. Other than that, very good game and would definitely recommend to my friends"
8,9,2022-07-31,2022,07,31,5,Angela Erickson,"I love this game! It's super fun when I'm bored. I would enjoy it thought if the jump button wasn't so small for mobile device. I think a lot of the items in the shop as well as gamepasses are very spendy. Also, not sure if this is only me, but whenever I try to install roblox after unistalling the game, it usually never installs. It's always pending, and I can never get it to work. (Edit) I've changed my review, and I love it more. I still think some items are a bit spendy, but overall, love!"
9,10,2022-08-15,2022,08,15,5,KitKat OMG,"Amazing game! My favorite accualy. But there is this bug , but I'm not going to give it 4 stars because of that. But the bug is that when I'm typing, sometimes my keyboard (BTW I play on my phone) goes away.. I'm not sure why but it's quite annoying, but it might just be my phone. But I doubt that, because my phone is brand new. Otherwise, great game! 100% recommend. If you could fix this bug that would be great! Keep up the good work, creator!"
10,11,2022-07-29,2022,07,29,5,•Gacha_Zigz•,"This app is amazing! I have had it for many many many years now and love it! I have made lots of friends, met new people, and had so much fun, my favorite games at the moment are Adopt Me, Cheese Escape, Aperiaphobia (I think its spelled), and many more but the reason I am leaving a review is because I saw alot of people having a problem on mobile where the screen wont let you move as it zooms in and out, all you have to do is get off the game clear it and then turn your device off, get back on."
11,12,2022-07-28,2022,07,28,4,Dennis,It's great and has multiple experiences but people can bypass and do bad things. I randomly got kicked from one of my accounts because of my connection and I wasn't able to get it back but it doesn't matter sence it was a while ago. There is a glitch where your screen gets stuck and you can't move it and you can only zoom in and out. I've been playing for a while and it gives nothing but fun
12,13,2022-08-04,2022,08,04,4,Phoenix Clinton,"This is a great game,YOU can make so many friends and there are so many games! It's so fun to play I'm addicted to it. I would rate it 5 stars but I have an issue... If your on mobile sometimes when you open the menu your joystick messes up and thinks it's the screen, for example you try to go forward you go forward BUT your screen goes up. Please fix this bug"
13,14,2022-08-02,2022,08,02,5,Kasandra Hernandez,"i gave it a five star because it has no ads and there are plenty of games to play. it's the only game i play and can never get tired of playing, but there is a problem i hope roblox fixes. whenever i accidentally click on a notification and go back to playing its hard to move the screen. while i move my character the screen moves aswell and it's annoying everytime because i always have to leave and rejoin the game. i hope they do fix it so playing can be alot more fun for everyone!"
14,15,2022-07-29,2022,07,29,4,Lorraine Coyle,Pretty good. But after a long time (Like 1 year or 2) it gets kinda boring. Also I belive this is a commom glitch but sometimes when you are playing a game (For me it has just been bloxburg) you try to move you view / angle you can only zoom in and out. But this is a minor glitch and all you have to do is rest to fix it. Thats it! Overall GREAT game. Now I am off to play some more.
15,16,2022-07-29,2022,07,29,4,A Google user,"there are so many games to play. I like that it has different types of games so you can play what you want. Something irritating about playing on mobile is that it sometimes makes me zoom in and out instead of allowing me to turn my camera. It's really frustrating because it means I have to leave and rejoin, reseting character doesn't fix the issue."
16,17,2022-08-23,2022,08,23,1,Christopher,"Even on the best wifi service, this game still proceeds to lag. I can't even turn my camera without worrying that it will get stuck. And I have 2 questions: Why is the joy stick and thumbstick so small and What is the problem with making the joystick and thumbstick bigger? And the camera is so sensitive that it will turn to another direction without reason And I asked the devs to help me with hackers, Inappropriate context, Bugs Etc and not once did they fix my problems. Fix this PLEASE!"
17,18,2022-08-19,2022,08,19,4,Barbara McKnight,"Its an amazing game with so many new people you can meet, and its quick to get into a game or server. Best thing is, you can even make your own game! I'm telling you if you love fun, exploring, challenges, roleplaying, and more you should consider getting the app. There will be updates that come once in a while but, they aren't much of a problem and help to make the app run smoother."
18,19,2022-08-03,2022,08,03,5,T eh,"I've been playing for years and it just keeps getting better. The graphics are vivid once in possession of the right device and excellent service. There is an abundance experiences to choose from. Avatar customization options are infinite, due to the frequent updates, and the ability to design the outfit of one's Avatar."
19,20,2022-08-03,2022,08,03,4,Rainbow God,"This game has it's downsides, for example getting rid of the oof sound, lots of hacking issues and I could go on all day. But to be honest, it's not as bad as the average person says. There's lots of classics, and you'll get lots of nostalgia when playing games like Roblox Crossroads if you played back in 2006 or 2007. There's also some REALLY good graphics in a handful of games as well. There's also literally BILLIONS of BILLIONS of games of your liking! Overall, it's not the best, but awesome!"
20,21,2022-08-08,2022,08,08,5,B1qil,"Fun, it is very addicting, when I play, I play until an electronic dies and then im screwed. A few problems I have is the glitch where instead of moving your screen, you zoom in and out uncontrollably. And sometimes when I use the dynamic thumbstick, it moves my screen as well, of which can go on for multiple minutes at a time."
21,22,2022-08-01,2022,08,01,4,chip,"Small bugs, they especially show up for mobile players. But computer isn't to bad. It has everything, yeah everything. You kinda gotta get your moderation fixed. I got a warning for uploading a decal of a dark blue color, yet maybe hundreds of worse things get accepted without hesitation. You NEED to sort that out. Either way, it has a lot of games and it's pretty easy to make friends who share the same interests as you. I would reccomend!"
22,23,2022-08-20,2022,08,20,4,Selena Mayeshiba,"Roblox is a great game that has plenty of variety for games, but there are some camera glitches on mobile I would like to talk about. Sometimes, the screen freezes, and I have to leave and rejoin. Other times, when I use the joystick, it's as if I am zooming in and out of the camera. If this could get fixed it would be an easy 5 stars, but otherwise, it is a great game to play with friends! It has it's uos and downs, but it's a great game."
23,24,2022-08-04,2022,08,04,5,Talia A,"I love Roblox, and I grew up on it. I do have two issues though. If I respond to a message on my phone or open the panel where you can see the people that are in the sever or where you can leave the game and close that panel, the screen has a glitch where it zooms in and out. I've seen other people are having this issue too. The second issue it where I try to move my screen and it moves my entire character like I am zoomed in. Fix it please?"
24,25,2022-08-15,2022,08,15,4,Roblox player 2.0,"This game is good I just have some problems. #1 when I join a game it takes longer for others than me and sometimes is really glitchy with 2 or more people playing. #2 I know everyone has this bug but when I equip an item it says something like ""the selected items you equipped are no longer available"" It's really annoying because I have to go back and equip. #3 This hardly ever happens but when I play a game Roblox glitches, freezes, then relloads. Please fix this!"
25,26,2022-08-15,2022,08,15,5,Landon Hillyard,"I love this game, I use it almost all the time. It's very fun to play with friends. I'd recommend children 10 years or older can play. The game consists of multiple experiences created by other users on the app and, you can also create your own game. There's options for parents to limit interaction with other players online if they choose. I've noticed a problem that has been complained about before, when you open up the main UI in-game, sometimes it bugs your screen. (Only affects mobile users)"
26,27,2022-08-02,2022,08,02,4,John Merritt,"This game is so fun for me I love playing it. However sometimes I recieve little bugs on some games and glitches where it just kicks me off the game. It's also a little hard to play on a computer. Especially obbies. But other than that, if those were fixed, I would give this game a 10/10! I would definately still recomend this game to anyone. Especially younger kids :)"
27,28,2022-08-02,2022,08,02,5,Ava Myers,"HELLO!! Roblox is a great game, but I wanted to say what caused the issue of not moving the camera the right way, or the 'zooming' glitch. When You're moving you player in the game as you click the Player list or menu, it will cause this bug with your camera. But if you stop walking first, it should be mostly fixed. Leaving and re-joing fixes this bug as well. I've learned from personal experiences and tested this, so I know it works. Try it for yourself if you have this problem!"
28,29,2022-08-17,2022,08,17,4,No,"It is cool, there are lots of games to choose from. I like that you can play on mobile or pc, however there are some glitches on mobile that you don't find on computer. For example sometimes the screen/camera glitches and you either cant move the camera or it zooms in/out instead of turning. Besides that it is pretty good. I like that there is so many character customization options as well, although you have to pay for some of them."
29,30,2022-07-30,2022,07,30,4,Ellie Torres,This game is great! But some annoying things happens when your on mobile like sometimes I can only zoom in and out so I have to rejoin the game again. And the jump button will press it's self nonstop and it's a little bit hard to play. I don't really know if this happens to everyone but whenever your play a game it just send you back to the Roblox loading screen it doesn't really happens that much. But still Roblox is a great game! I would highly recommend this game!
30,31,2022-07-31,2022,07,31,5,Bug,"I'm giving it 5 stars because I grew up on this game it defined an entire generation, not alot of games can accomplish that. However there are some issues,in some games when you exit the player list you can move your camera at all, and sometimes the dynamic joystick bugs out and control ls both the camera and the and the players movement, usually this isn't a problem, however with my device I have to use the classic joystick, which makes it difficult to play because I play on my phone. Fix it?"
31,32,2022-07-29,2022,07,29,4,Gabby,"Game is awsome! There are so many games to choose from and you can edit and so many other things!! But why did I rate it 4 stars? Well, sometimes I type in a normal question and it tags. Also, when I buy something, after like a week it's unavilable. It really frustates me and I really wish we could refund! There's also been a problem with the screen. Sometimes when I'm playing a game It locks and I can't move and can only zoom. But very great game! Keeps me entertained all the time!!"
32,33,2022-07-25,2022,07,25,5,That Weirdo Gurl,"I definitely love Roblox. I usually play it on my laptop but I lost my mouse so I have been playing it on my phone. I know a lot of people have glitching problems, but personally I don't. I don't like that in some games the developer has the option to choose which movement mode you have to use, but I guess I can overlook it for now. Overall, great app!"
33,34,2022-08-02,2022,08,02,5,tigers in hell,"I rate 5 stars because I grew up on it, but there are some issues and bugs if you could fix them roblox I would play more. #1. Sometimes the screen bugs out and u can't really walk unless your screen gets zoomed out, but you can fix it by getting in a car if ur in a game like brookhaven, adopt me, etc. with cars u can but if there are no cars you can't. You can't reset your character and it go back to normal, you would have to rejoin. Well that's all I can think of right now I will re-edit it"
34,35,2022-07-28,2022,07,28,4,Maria Perez,"I love this game! This game is full of loads of fun and other stuff. Although, there are a few downfalls. Some games can get laggy for no reason. You could have perfectly good internet and nothing happening in the game and it just starts lagging. Another thing is that there is this bug in ANY game where you don't have control of the screen and it just starts zooming in and out. I find that annoying because it ruins my experience in a game. But it is really fun and an awesome game! I recommend!"
35,36,2022-08-05,2022,08,05,4,Justin Little,"Best app no contest, it's almost perfect but there is 2 flaus, 1. when I go to play a game it's almost instant when it shuts the game off and put me on the home screen then I have to shut the whole app down to get it off the main screen, & 2. Sometimes when I play a game, the screen locks and its really annoying, but other than that, it's perfect."
36,37,2022-07-29,2022,07,29,5,Olivia Myers,"Great: but I have a issue This game is very great, most of the time when I get the chance to play this game I do, but i do have one issue. Sometimes when trying to move the screen it wouldn't move, it can only zoom in and out and it was interrupting my gameplay, and most of the time I have to exit the game for it to go back to normal, and sometimes I get disconnected randomly as well Other than that, this game is very fun, just needs a little fixing then and there."
37,38,2022-07-26,2022,07,26,5,Gayle Ducharme,"Roblox is one of my favorite games to play but there are a few little problems. The first problem is randomly the screen will lock and I can't move, and the second problem is sometimes when I go to move the only thing is does is make the screen go in and out.... other than that everything else about this app is amazing and I recommend this to whoever is reading this!!"
38,39,2022-07-29,2022,07,29,4,Melanie Guzman,"Roblox is a great game, lots of experiences. And is a great game for u and ur friends. I have 1 problem tho. Sometimes when playing a game the screen glitches. It doesn't move. And it's frozen and when you reset your character it really doesn't do anything. You can only zoom in and out. I really hope Roblox fixes this. I bet lots of people are having the same experience. Other than that. It's a great game."
39,40,2022-08-02,2022,08,02,5,Stephanie Gaston,"This app is great. It allows you to interact with others and make friends, and you can also learn things on the app. So its an educational experience and also a fun app to cure your boredom. Its a fun game for kids, and adults! But sometimes there is a few issues. For example; sometimes when I am still for a moment, the screen glitches and zooms in and out. I hope that it is fixed soon. Other than that, Im rating it 5 stars."
40,41,2022-07-29,2022,07,29,5,Ralsei Key,"It's just a little away from being flawless, the thing with flaws is either your device, or your wifi/service(<-which ever one you use). I play it with absolutely no problems and I play on an newer phone. Like I said, depends, it is definitely true that when you receive a message or something snd it comes up on the screen, when you try to change the camera angle it just barely moves your character and only zooms in and out. No other problems I know of lol."
41,42,2022-08-19,2022,08,19,4,S1mply_K1tty,"Roblox is a great game, but I'm experiencing issues with the Avatar Editor. I don't know if it's because I purchased too many pants and shirts, but all of my old pants and shirts just aren't showing up anymore. Sure I can close the game and open it back up, but it's just going to keep making my shirts and pants not show up. Also, whenever I equip something, it sometimes has a message saying ""Some items that were equipped are no longer available""."
42,43,2022-07-29,2022,07,29,3,Hopeless Hobi,"I've played Roblox for years, and have had no problems with it and overall, have no issues but one. When I try to buy robux, I tap on it and it just doesn't show any options to buy any, this also happens when trying to look at a player's profile trying to look at their past usernames, and also happens when trying to change my password. I play on mobile and this might not happen to people on PC."
43,44,2022-07-29,2022,07,29,5,Juice Man,Nice game👍. I've had the same issues as all the replys. The in and out bug. Now the only way to prevent this from happening is to not press the Roblox Button when you are moving and in the game. And that's not even a bug it just normally happens if you accidentally press the Roblox button (happens to me alot of times..Unfortunately..). And it sometimes happens when you press the home button on your phone (ios or Android). I hope this helps for the people asking to fix the issue up.👍
44,45,2022-07-28,2022,07,28,3,Misha Ayala Orozco,"I LOVE Roblox! Ever sense I found out about it, it's basically all I played! But, it does have issues. Whenever I'm playing a type of game, it would take forever to load or kick me out back to homescreen. The screen would also freeze or make it to where the joystick glitches. My device would also say ""Roblox is not responding"" and I would keep trying to play until it would work again. Yes, it's a great game, but it needs work. I would love it even more if you fixed these issues please!"
45,46,2022-07-14,2022,07,14,5,keiti -,"This game is nearly perfect. everything is fine if u are on a good device, works well even for Android phones.the catalog has many items to choose from. All styles and aesthetics are able to make avatars that will be exactly their style. The rthro avatars are just ugly most of the time though. Most people aren't a fan of rthro. The games are unique and fun to play too! You can easily find the right game to fit your criteria if you search for it! Five star rating."
46,47,2022-08-02,2022,08,02,5,Krystal Post,"This game is awsome, the new 3D clothes are awaome as well, some of my favorite are Warrior cats: ultimate edition, and Gacha online, very fun games and thank to roblox I can play them!, If you don't have the app, you should get it, but there is some problems, like when you're screen glitches, instead of looking around you just zoom in and out, and another downfall, is something that happens to me and a few of my friends, when we try to leave or reset, if freezes up, other then that great game!"
47,48,2022-08-03,2022,08,03,4,Ryder Kaiden,"Really good game. but there is some bugs like when you play on mobile. the joystick is very small""not really a bug"". however i do play on tablet so good for me. also sometimes when you go to the player list. and then turn your camera. it zooms in or zooms out. and when you join a really laggy game that is really good. it just crashes. ""only for me i think"" but really great game."
48,49,2022-06-22,2022,06,22,4,Jessalyn Apilado,"Amazing, but it has its flaws. Occasionally on mobile you can accidentally open the settings and the screen will go all wonky or just freeze up entirely, and lately I've been having trouble joining and moving. I crash, glitch, and lag a ridiculous amount of times. Overall, the best game I've played! Just please fix these things, it would help a ton."
49,50,2022-07-13,2022,07,13,4,Eric K Yung,"Great game. There are a few bugs and issues though. On certain games your screen just suddenly stops turning around and goes in and out, no matter how you move it. Sometimes, it gets really laggy and glitchy that it kicks users out of the game. There should also be a option to change your main screen to any color you would like and have more clothes options for people without Robux. Other than that, I would love to keep playing this game! 🤗"
50,51,2022-06-27,2022,06,27,4,Carlos Marone,"It's a great game, with thousands of cool games with all different genres and super entertaining. However, mobile users such as myself have reported a LOT of glitches and lag. For me, I can be playing a game and then all of a sudden my screen freezes and my screen turns black and says one of two things, one of them being ""Roblox is not responding"". It would be great if I knew whether if was Roblox's issue or mine. But again, the game is awesome!"
51,52,2022-07-20,2022,07,20,3,anjel,"Roblox is a great app, it really is. I do have an issue though, and people that I know have had the same issue. Sometimes when playing a game, the screen glitches and however you touch the screen or reset, it does nothing. All it does is zoom in and out. It will barely move your avatar, and instead, just zoom in and out. We've all had this problem on mobile and I hope Roblox fixes this bug."
52,53,2022-06-30,2022,06,30,5,Preppy Gal,"This Game Is Awesome! Although, the moblie version has a few glitches. 1. When Im playing, the game will freeze and I can't move my character, and then i disconnect from the game. 2. When I try to enter a game the screen freezes and roblox shuts down. I dont know if it's just my phone or if its a problem with the game. If it is a problem with the game can it please be fixed to increase the quality? Anyways, I give it 5/5 stars."
