,id,date,date_year,date_month,date_day,rating,user_name,content
1668,1669,2022-07-30,2022,07,30,3,Ginger Casper,"(This is my grandma's phone) Roblox is a good game and all, But when your playing a game holding a phone if thas what your using, sometimes it'll glitch and while your walking in game it'll automatically show the icon that says ""reset leave or resume"" and then when you get out of it you can't even turn your screen, it only let's you zoom in and out and if it happens again it won't let you do anything with your screen but walk in a game. This needs to be fixed.."
1669,1670,2022-07-29,2022,07,29,5,A Google user,"Thanks for fixing the glitches, the game is stabilized, and better, I appreciate the game, thank you. For those who are just downloading this game, I would really suggest it, there is is something out there for everyone! Drawing games, to fighting, and role playing, and you can even make your own! Really think everyone should give it a try, really nice and though out app. Highly recommend."
1670,1671,2022-07-30,2022,07,30,5,Sam,"This is a very fun, entertaining game to play when you are bored. There are many ways to dress up your avatar and so many games to play. It is a very social game, you can make lots of friends on here too, that way games dont get too boring. There are many badges you can win and a bunch of passes to get. You can even win some items from the games themselves. I definently recommend this game to others, it is time well spent and very fun! <3"
1671,1672,2022-08-14,2022,08,14,5,Scarlett Finch,"Roblox is a fun and interesting game to play I've been playing for years now and it's still really fun! I gave it 5 starts because it's well deserved. The only complain is that roblox brakes a lot more than it should. Also the ""oof"" sound is gone I know it isn't Robloxs fault but it's kinda bad now. Overall it's a good game and I completely recommend it."
1672,1673,2022-07-25,2022,07,25,3,welcome to valerieland,"Roblox is an amazing game and all, but there are many issues. For example, whenever I join a game it kicks me out of the whole app and if I do end up getting in the game its just extremly laggy and glitchy. When im playing something it just says i disconnected when my internet is 100% full. Also, the game requires so much space. I play mobile and sometimes it gets so bad i cant even update my avatar. Lastly, there should be more cloth options for new people that cant afford robux. good game tho!"
1673,1674,2022-08-01,2022,08,01,5,Jannat Rahman,"This game is totally amazing- i literally cant live without it. i seriously recommend this game, i have never seen a game with over 1 million games inside it. roblox is a GREAT game, and also has fantastic games on it. However, high graphic games cause me to crash and then i cant go back to roblox. but this is not a problem as i can just download it again :/. there are also great remixes of other games and realistic stuff and yh- i love this game to bits, keep it up roblox!:D we all love it! :)"
1674,1675,2022-07-29,2022,07,29,3,Ł ß,I like how it has many games for when your bored but I don't like how sometimes my character will jump when I'm not pressing the jump button and how it kicks me out of games. It does have glitches. And I don't like how when I try to move my screen zoomed itself in and out. Its annoying. But other than that I like to play it when I'm bored.
1675,1676,2022-08-14,2022,08,14,2,lazy_shinkuu,"Why is my Roblox suddenly not working for me while all my other friends have their application working for them? It's frustrating. I'm connected to the internet and it's pretty strong when I use to her apps. I keep on logging out, deleting and installing the game so it would work for me but it just doesn't seem to work today anymore. Why is this happening? Edit: filters in your chat is pissing me off. I can't even write my own name!"
1676,1677,2022-07-31,2022,07,31,2,Alessia,"Roblox is the best! In the past it was. In the past I could play those fun games, but now it's no use to play Roblox. I can't even play a single game, I can play less than 1 game. I gave it 2 stars because in the past I was having lots of fun, but now? Like I said, ITS NO USE TO PLAY ROBLOX. now bye, I will come back to Roblox if you fix this issue. And dennis? I read his review, that same only zoom in and out glitch happens to me in most games."
1677,1678,2022-07-29,2022,07,29,5,Nour Mandour,"I LOVE THIS GAME ITS THE BEST GAME EVER ,but there's a glitch it's like a camera glitch I don't have a problem with it you can just leave and rejoin but you can be doing something important, for example:if your playing scp 3008 and you have alot of food if you leave and rejoin you will lose all the food and your way point too but its a great game I recommend never getting rid of it"
1678,1679,2022-07-31,2022,07,31,3,Lee Rez,"I do like this game and it's really amazing! But there are a few problems. I disconnect a lot for no reason and when I'm playing with others I also get disconnected and I cant get in again. Also everytime I make an account it deletes it and I lose my progress. So, if you can, could you please fix these problems?"
1679,1680,2022-07-26,2022,07,26,4,Mario Sharra,"Amazing game. But to much bugs have been found by so many people. Some games can be randomly laggy on some phones. Like: Samsung, Huawei, Dodgee etc. And the games that can be found laggy is: murder mystery 2, tower of h@ll, tower of misery etc. Thats the reason why im giving it 4 stars. Just the bugs are so annyoing. Pls fix it. I have been playing this game since 2021/hated the bugs etc. So pls fix it. Thats the most annyoing thing in some games."
1680,1681,2022-08-09,2022,08,09,5,Kaylyn Wong,"I really love this game! We can make friends, play together, and even but stuff! But one problem, sometimes when I try to dress up it says like 'the thing you wear is not avalible.' im not sure if it said that but can you try to fix it? Please and thank you! Also, downlad ROBLOX! Its amazing!"
1681,1682,2022-07-30,2022,07,30,4,Pashmina Balquedra,"I give 4/5 because it have so many bugs and when I try to sign up it said (please retry) ,when I get avatar it is always laggy, when I play it is always zoom in and zoom out and it is jumping. Please fix the bug. But I still like it and so many gamess I REALLY LIKE THIS GAME"
1682,1683,2022-08-16,2022,08,16,4,A Google user,"The best game in the world , I've been playing for as long as I can remember and I only have one issue, I wish they would fix the r6 because now you cant layer hair accessories with it on and even r15 and it really makes me frustrated now that i cant, but I think the games are amazing and I could literally play this all day long, there is such a variety of places to go, it is also a good game for kids I'd say 7 and up because you cannot say anything bad and if you do it hashtags it, thank you😊"
1683,1684,2022-08-04,2022,08,04,4,MyNameIsNotDavid Ok?,Its a great game but the screen glitches and the dynamic joystick is wacky and it kicks me out of the game but it will fix if you uninstall and reinstall but it can still happen again but the main focus is the games they are excellent (except for the games that are not) but the games page has good games nonetheless
1684,1685,2022-08-02,2022,08,02,5,Madimak Morgan,"I give this game 5 stars since I grew up on Roblox and have been playing for a long time. Whenever I'm bored it's my go to game. Even though sometimes Roblox is down due to a few technical difficulties, it always works out in the end and we get to have fun playing it. Though there are different styles around such as preppy, cnp, slenders etc , everyone has fun."
1685,1686,2022-07-25,2022,07,25,2,Gabriel M Montalvo,"Roblox has very questionable decisions in terms of looking into NFTs, Pushing the idea of a metaverse in the worst ways possible, and Voice chat being limited to only some. Also the experience on Android and such is extremely laggy. Also at this point you'd think they would add more computer power to their darn systems"
1686,1687,2022-08-12,2022,08,12,4,Peyton Geller,"Great game, Although that sometimes the screen glitches and when i reset, I can't move the camera and i can't move my character. I would like if this bug will be fixed, but overall, Its an awesome experience"
1687,1688,2022-08-11,2022,08,11,4,Charlotte Drew,there are some things wrong with it like the lag and the slow chat. but it has crashed twice and it needs some new games plus it does not show my avatar so it is okay but the good thing about it is that it is fun and has tags to stop something mean or rude from happining so overall i give it a 4.5 xx also i wish like most of the clothing and hair was free
1688,1689,2022-07-29,2022,07,29,4,Adione Van der Merwe,A love this game it has a lot of fun games to play.🌼 There is just 2 problems when a play a game it kicks me out and the second one my WiFi is there on my screen and a can't get in it happens sense last night and I'm trying to get in. ☹️
1689,1690,2022-08-01,2022,08,01,4,Jovita Abucay,"This game is pretty fun and decent, The only things that are a bit off for me are that, you have to pay to change your group name-? Honestly i think thats kinda crazy because, you already purchased the game, so what if you want to change the name??? And my second one, is that some of the games are really laggy, and like theres this game that doesnt let me join, so basically i click join, then when it goes into the game it just exits me out of roblox, and into my ipad homescreen."
1690,1691,2022-07-30,2022,07,30,5,Barirah Muzamil,"It's an amazing app and entertainment for me, I play it almost every now and then, whenever I have time. I mostly play with my best friend from school, it's so fun. I will give it 5 stars, but the thing is, you have to pay actual money to get robux, which is kinda unfair. The rule Roblox made is pretty unfair, 'cause you can atleat give like 2 or 3 robux FOR AT LEAST A MONTH! No offense, though! Really amazing development, thanks to this game, it makes me feel calm, somehow."
1691,1692,2022-08-09,2022,08,09,4,Kayla Maldonado,"This is an amazing game overall.Its one of those games with many games inside.Its very fun 👍.You can make games but only on pc, play with your friends,play by yourself,and play games.Not much more to say about it.But on mobile sometimes the screen won't move, I don't know if that problem happens on any other devices."
1692,1693,2022-07-29,2022,07,29,4,Shinko Jokyo,I honestly think it's a great game but there's something that's happened to me way to many times and that's getting logged out of my account. I've been locked out of a total of 4 of my accounts and I kept having to make new ones and start all over from my game progress. I don't know if this is just me but I'd really love to get back into those accounts
1693,1694,2022-08-03,2022,08,03,5,Julia Loehn,I love roblox. when will you guys make more games like that? It is the best game ever!! There are so many different games for different people! It is fun and teaches you things!! Like: Tower of Hell - Never give up even when you fall! Welcome to Bloxburg - Money doesn't just grow on trees you have to work hard for it!! #robloxislife
1694,1695,2022-08-05,2022,08,05,4,JJ NN,I like the game....but in many of the games you have to pay robux to get things. I do like that you get to play with multiple people/make friends. I think that you should get more free things.... no ads which is good...... overall this is a good game.
1695,1696,2022-07-31,2022,07,31,5,Kingston Cash,"I really like this game it's fun and it's nice to explore and experience different games,there's some glitch that happens we're the screen only zooms in and out it's very anyoing whenever your playing with your friends or role playing some times I think it would lose downloads because of that please fix it I really like this game please update it more it's really fun and you can make your avatar look like your self haha it's kinda funny we're you can make funny avatars please make more updates"
1696,1697,2022-08-03,2022,08,03,5,noah468 Corp.,Played the game for ages but I have to help my younger brother with stuff in setting like privacy so is not that great for younge people with parents who don't understant technology. Maybe if you add a thing like where someone submits there age and there younge it a simplified version for settings
1697,1698,2022-08-07,2022,08,07,4,Isa Dlt,"I love this app it's a great place too get your mind off of things, there is also a wide variety of games too chose from, roleplay, obbys, simulators, and more! I also love too make friends and chat with people, sometimes I die from laughter because of the chat! Though there is one issue lately there has been a lot of laggs, people getting banned for no reason, and people getting hacked. It has been going on for quite sometime, I think Roblox needs to fix this issue, But overall I love the app!"
1698,1699,2022-07-27,2022,07,27,4,Kade,"Roblox is a good game if you're looking for friends, but lately it's been bland, If you've been on the app for even a second you know the moderation sucks, but in all honesty it's a pretty fun game , but the playerbase is sometimes very problematic; Roblox is genuinely a fun experience and social game, could be better if they weren't getting rid of R6. This is a fun game to hang out with friends and family!"
1699,1700,2022-08-07,2022,08,07,5,Soumitra Bhattacharyya,"This game hang so much but this game is amazing and I love that it is an arcade game and contains of action, horror, comedy, romance each and everything is available here thats I love this game and we really reallly miss the old off sound but the new sound is not that bad in my point of view. I recommend to update more features. With thanks, Your faithfully gamer, Random"
1700,1701,2022-08-05,2022,08,05,5,A Google user,This game is amazing to play and I feel like it's very graphic and the quality is very good Not only that it's that there's so many games in one download alot of kind people on roblox and I think it's a kind of intermediate to be able to go on any game and just play with no stress but when you do it's better than amazing And if you have someone else to play with you can race them to the end of a certain game of your choice so you can just enjoy the games stress relieved So I think 10/10
1701,1702,2022-08-05,2022,08,05,4,Fear Thefluff,"Alot had changed with Roblox since I've started playing, changes of avatar designs, tons of new games, new death sound ETC. I really enjoy the game! The constant lag is not enjoya le but I think the large variety of games that are less laggy makes up for that."
1702,1703,2022-07-30,2022,07,30,4,Amarin Pantanapichet,"Its really fun but there are a deacent amount of bugs and glitches, like if your jumping for a long time and you let go it will keep jumping. Also if you are walking it randomly starts keep going and you have to reset."
1703,1704,2022-08-01,2022,08,01,4,Layla Welch,I have had Roblox ever since I was a little kid and I loved it because you could play games with your friends all u have to do is send them a friend request and make friends so like then you can just play with them.Join their game you can just have fun. But things I don't like about this game is that sometimes it kicks you out of the game and whenever you disconnect from the internet on accident or you lose a little bit of Wi-Fi and games will not load all of the time.
1704,1705,2022-08-07,2022,08,07,3,Sophia*Joy C-C,"I gave this a 3 star because a lot of mobile players has experience a big problem here. however, this game is really fun and I like it. The camera is always stuck and I experience it several times. You have to probably press a button or leave for that to be fixed. Toxic players and ODers are ruining it. The new update is worst and people hate the new OOF sound which sounds like an anime girl. but this game is my liking."
1705,1706,2022-08-04,2022,08,04,5,Sharon Martin,"The App is amazing. But the only bad thing I can say is the fact that I met a mind blowing jerk. I'm very honest and so down to Earth!! I am an older woman, disabled due to a tragic accident. Had a TBI to an extreme degree! I thought I met an Angel sent from God. He played the part very well! He followed me for months! However it changed my life. I had purpose again. Well he wound up breaking my Heart!! I still love the game!! It's amazing for adults too!! Just like everything internet has some connection problems but for the amount of people that play the game its not all that bad. Nothing is perfect!!"
1706,1707,2022-07-27,2022,07,27,3,Karen Rivera,It's an awesome game it has a lot of exciting things to have and it is really quick sometimes in joining a server. But it's very glitch especially when I play roblox on my phone and sometimes it kicks me so I have to rejoin. It's sometimes very difficult to join a server but if the game loads Its very enjoyable.
1707,1708,2022-07-26,2022,07,26,5,Ivan Danganan,"Really great app I like how there's so many games that I could play with although it's a big buggy sometimes and the gameplay lags but all in all it is a great app and definitely worth to download, this apo can be enjoyed by multiple person at a time but one thing is pls fix like the bugs on avatar. That's all thank you!"
1708,1709,2022-08-06,2022,08,06,4,Abbey Joan,"This game is extra making me happy! But I want to friend lots of people, but it's max limit 200! That's okay, I still love this and I love the part when there are new updates in games! But can you make Robux a little bit cheaper? But thanks for making this game toooooooo much extreme, my favorite is Zombie Attack, Brookhaven, and Tower defense simulator, thanks for reading my review, I hope you have a bright day, bye!👏👋👍 And also, please make the eugh into oof again, we miss the oof sound"
1709,1710,2022-07-25,2022,07,25,5,YS RIN,"This game is so fun! At first I thought this game is boring since its for kids..BUT I NEVER THOUGHT THAT THIS GAME IS ACTUALLY GOOD AND FUN.I just have a bit of a problem, my problem is when you go to the shop where you buy stuff for your avatar, it lags like 15 minutes of looking at the shop then it will go to my homscreen when it starts to lag :((("
1710,1711,2022-07-29,2022,07,29,4,Usman Umar,"The game is very relaxing and enjoying, never played a game with the things we want like roleplay with friends and much more. But the problem is the screen glitchs every time during playing."
1711,1712,2022-08-07,2022,08,07,4,el,"i love this game, play it on mobile and pc, and bought robux on multiple occasions. only real complaint i have is that whenever i'm on mobile my game often crashes. during play through and just on the app designing a character ect. its really annoying."
1712,1713,2022-08-12,2022,08,12,5,Chanel Song,Its a fun game for kids/adults (if they wanna play) everyone loves Roblox! But we miss the oof sound. When you would die as in the game there would be an oof sound we all got connected to that sound but now it's replaced by a sound that goes DUH! We loved the oof sound but it's gone. This is all I'm going to write if you think this is interesting you can download it now! And experience it!
1713,1714,2022-07-30,2022,07,30,4,MeleeUser,Great game but it bugs out and you can only zoom in and out. The radio passes were pretty muchtaken away bc we cant play what we want inatead we get to pick some from a preset list. I didnt spend over 3k robux on radio passes to pick from a lreset list.
1714,1715,2022-07-29,2022,07,29,4,Daniel Bruce,I love the game! robux is so cheap its really a fair price! and not to mention how fun all the games are. though theirs a glitch. sometimes when i buy robux it disapears and sometimes it can be super laggy. other than that its a good high quality game and the bug updates really been helping alot with lag recently! BUT PLEASE BRING BACK OLD OOF SOUND IK ITS COPYRIGHTED BUT IT SOUNDS LIKE THE MINECRAFT ENDERMAN
1715,1716,2022-07-30,2022,07,30,4,Ramel Anthony Palomo,Hi i have been playing this game for a while now its a good app but i keep encountering these 2 bugs 1 the screen suddenly shakes and when u try to look around u can only see at the bottom 2 sometimes when i play a game for like 45 minutes when i try to look around it wont let me it only zoom's out and in pls fix this because its driving me crazy
1716,1717,2022-08-07,2022,08,07,5,Lamya Lami,"It's the best game EVERR! Just two bugs I think you should fix. My first one is, When I want to check, like let's say how much people are in my sever. So I press the Roblox button in the corner, then when I press resume when I start walking, the screen moves on its own. Second, In Brookhaven, there is a t shirt that is like a fire kinda crop top with shorts and the same fire design, but when I press it takes all my clothes off. Other than that I think Roblox is the best. 😁"
1717,1718,2022-08-01,2022,08,01,4,jill pursell,"This is a good game, but there is quite a lot of lag/glitches. I think this might be my computer, but when I type in anything. Chat, numbers, etc. I can't move. Besides when i'm not playing a game. Also, when I report someone who is doing something rude/innapropriate, I get banned half the time. All in all, pretty fine game, and am looking forward to bigger and better games."
1718,1719,2022-07-29,2022,07,29,3,Sydney Phillips,"It used to be 5 stars but I just can't keep it there. They used to be so great but the community and game is just degrading every update, honestly I don't know if I can play it in a few years with how it's going. I'm just not putting it below 3 stars because of the memories I've made with it for the past 7 years."
1719,1720,2022-07-25,2022,07,25,2,Rhett Akins,"The password reset is not immediate for mobile users who have to use the app, meaning that people will reset there password multiple times before giving up on the app or waiting on it. Also when I log out of my account to play on another it always tells me my password is wrong when I try to log back in. Please fix , then I'll bump up my rating."
1720,1721,2022-07-31,2022,07,31,5,Nsresh Babu,This game has everything you want to play it is good but it does have some bugs. The wallhop system. the game is so great. I love the wallhop system. Definitely a 10/10 for me. The graphics is also nice. With the shaders it's even better.
1721,1722,2022-08-13,2022,08,13,4,Ruby Colman,It is a really good game but for servers if you want a really small server just so you don't have to scroll all the way down make options at the top say smallest and biggest because when I want a small server I have to scroll down a lot and bug fixes
1722,1723,2022-08-13,2022,08,13,4,Lynne Evans,"This game is amazing, so many mini games to choose from. Thrilling! there are soo many different genres of games e.g Horror, fantasy adventure etc. I like roblox because although it's fun it also has safety features such as chat being turned off and hashtags over curse words. Although one thing is, is that over random words it hashtags out like the word 'you' and more."
1723,1724,2022-07-29,2022,07,29,4,Liam Mc gloin,"Roblox is a great game to play ,but as it requires internet I always find it annoying to not be fit to play offline ,other than that there is no problem with roblox,but yet again if it had no need of internet usage it would be a far better experience in my opinion but also maybe lower the cost of robux as it's quite annoying it being so expensive I mean 10.99 is alot for just 800 so that could make an improvement though u have a complaint about this app I still love it and it's my go to app bye!"
1724,1725,2022-08-08,2022,08,08,1,Kee,"The continuous and instantaneous of failed teleportation is both an annoyance and disappointment. I caught wind of knowing Roblox being most wealthiest and always engrossing towards collaboration, never once was there any given nurture to the system. If you may be so kind as to take a closure inspection, gameplay wouldn't even be stifling your projects either way."
1725,1726,2022-08-04,2022,08,04,5,Queen Amathela Inguito,"I've been playing this for years now. So far, nothing's changed, It's still pretty enjoyable. Everything's good, I might even say they don't need to improve 'cause it's already perfect. There's just this update that I didn't like. When they changed the 'oof' sound effect. It's not really a big deal, it just seems kinda off. I've gotten used to the 'oof' sound by now and I think it was just perfect for the game. I really didn't see how it needed to be changed. But it's fine the game's good so far"
1726,1727,2022-07-28,2022,07,28,3,qualyn lewis,It's ok but it lags to much when ever someone does something AWESOME ⭐it starts to lag I was playing these 2 goku games but I can't see the buttons and on the other game I can see the buttons but I can't transform it really annoying that is why my rate is three stars if it weren't for those things it would be five stars
1727,1728,2022-08-02,2022,08,02,5,Lilly Toca,"I have started in 2022 because I wasn't sure if i wanted to play this. All because of the other ratings, I thought it was a good idea! Theone thing is, is that I'm kind of playing this 247 so this is not the healthyest. If anyone does read this just know that you probably will spend a lot of money because everything is bacicaly Robux. I still think its really fun because of the mini games inside of the game! I believe you shoud get the app!"
1728,1729,2022-08-02,2022,08,02,4,Dreaditsself,A great and well programed app! It gives its users a great exprierence. Although as a multimillion buisness I feel as if there should be less major hackings/Malfunctions examples are; About a month ago when the chat filter broke. And a few major hackers like 'tubers93' 1x1x1x1 and even the minor ones like Lolet. Its not something I would expect from a app as great as this.
