,id,date,date_year,date_month,date_day,rating,user_name,content
1108,1109,2022-07-23,2022,07,23,4,Fania Aurora,"I like this game it's so fun and playing with friend and play multiplayer, and there is a few things that is not working 1. When I'm joining on a server it's dont load fully 2.when I play an obby some of the part is invisible and I keep falling beacuse I don't know where is the jump 3.when I play some sort of building my screen just freeze but not whole screen 4.the screen is not moving and I just can move the character and zoom in and zoom out, Roblox please fix this!"
1109,1110,2022-08-17,2022,08,17,5,Hennisee Buchanan-Perrone,"It is a good app the only flaw is that recently I have not been able to get into roblox so right now I'm struggling wit that, but otherwise it would be a great app and y'all will enjoy it, a few days go by and I'm able to get back in but then I haven't used it for like a week and it won't let me log back in cause when I try to vertify it it says like it not able to arok right now try again later?? So can you please work on fixing this cause I really enjoy this app and Want to keep playing it!!"
1110,1111,2022-08-04,2022,08,04,5,_little_softie_,It's a really fun game. I would even tell people to play it .I like that you could play so much games and play with people and make friends. A thing I don't like is the updates like removing r6 etc and I also don't like is the lag. But in my total opinion it's a good game.
1111,1112,2022-06-22,2022,06,22,5,Feidge L. Cano,"The games in Roblox is good, but there's so many bugs when you play on Mobile and Tablets :) Just like when you were trying to move or swiping to look around.. It keeps zooming in and out ;-; . Fix that bug in Mobiles and Tablets. It's good too when you're gonna play in Computer but not everyone playing in Computer and mostly in Mobiles & Tabs. Just fix that bug, that's it :) . Yeah, Game is good. Yes,it's good. Not that bug:)"
1112,1113,2022-07-29,2022,07,29,3,TheSteveRemix,"This is a really good game, it's kid friendly and has plenty of online player-created games to choose from, won't delete this anytime soon! Edit: With the recent updates, things are getting worse. From music being unusable to the iconic 'oof' being removed, ROBLOX is now unfortunately something I may consider uninstalling."
1113,1114,2022-07-30,2022,07,30,5,Marjohn Magdaraog,"This is good! ❤❤❤ I kinda like this game even if you create a game but using a pc, it might be a little different, I don't know where to create game. But a little amazing! Not just too many ads there are NON-Ads!"
1114,1115,2022-06-11,2022,06,11,5,Ijustwantyobloo.d 8,"It's an amazing game. So many games to play in so many catagories. The robux only cost to 48 cents or 5 dollars, it's very cheap. But, when my Internet is running just fine, it says disconnected. It's probably just a me problem, but still. IT'S AN AWESOME GAME. Also, HAPPY PRIDE MONTH!"
1115,1116,2022-06-11,2022,06,11,4,Phoenix Rising,"Great game. I love how it has something for everyone. (Mystery, Parkour, roleplay, etc). The games graphics are good aswell as the hair and clothing selection. Great way to make friends or to play with your own. Despite all these good attributes, it does have to cons. Like the constant updates, or the fact that if you don't have robux(which costs money) theres no way you could actually enjoy the game, or the excessive amount of hackers, scammers, trolls, and bugs-for a childens game."
1116,1117,2022-08-02,2022,08,02,5,Myla Mooney,"I love this game it is like my only game that I have, it is super fun! And I enjoy playing it all day! It is family friendly and it is a great game to play on with friends. It has SO many games on it you can create a avatar and get cool accessories and outfits! So far it's is the best game I have played. It's very recommended from me!"
1117,1118,2022-06-21,2022,06,21,4,Foox,"This is a great game, but you should add back the feature to wear multiple hairs! This game is about creativity, right? There are so many creative hair combos that you can use for your avatar and it's sad that this is no longer a feature, you should be able to make your avatar the way you want it (appropriate ofc.) Other than this, the game is great overall and I do reccomend it. Thank you for reading!"
1118,1119,2022-08-01,2022,08,01,4,Cassandra Naegler,"This is a really good game and it has a good variety of things to play!the game has fun games like royal high, and tower of hell. Adopt me and more, those are just few of many many games to lay your eyes on! Make sure not to be toxic and scam in game. You can get banned for days or even forever. You can report people if they do something bad, this game is 11+ my only problem is when I try to update it, It won't let me"
1119,1120,2022-08-05,2022,08,05,5,Hacker Proof,"I mean this is more off an app with games which first of all is so clever besides that, this game is amazing you meet lots of people and make friends. I have a great time whilst I play, I don't think I have any negative thing to say apart of the max friends you can have. But like that's no big deal, Amazing game you should absolutely install it! Thumbs up 👍👍🤜🤛"
1120,1121,2022-07-30,2022,07,30,4,Madnesson,"This game has a bunch of games you can play. You can even create your own game. There's also a bunch of cool gamepasses. (They cost money aka Robux.) It's super fun playing with your friends. You can join groups or create your own group. You can customize your avatar with so many cool things. But, some people bypass the chat filter, (you are able to turn the chat off in settings) there are tons of exploiters, and glitches that can ruin the game."
1121,1122,2022-07-29,2022,07,29,5,Caden and Josh,I have been playing Roblox ever since 2016. This game has the best variety of games. You can make friends with people. And make your own world in Roblox. I definitely reccomend roblox to everyone. Although I am not a fan of the new 3D layered clothing because they don't fit around the characters well and it looks strange. Also they got rid of the Classic oof sound.
1122,1123,2022-07-29,2022,07,29,4,Anise,"This is by far, my favorite game. HOWEVER- There are a few issues. First off, people stealing, and hacking peoples accounts. Second, sometimes when I join a game, my camera is messed up. And third, people do some..uh..bad stuff on this game, they seem to have found single color skins I guess, that make them apear...Naked? Thats it- For me anyways"
1123,1124,2022-08-17,2022,08,17,5,Laila Bicknell,This is my favorite game and it is poplar but I have to download it to meny times I like it because it let's you decide your avatar but you have to pay for robux!!!!!! But so much fun with your friends and games !!!!!!!!!!! it's a fun but when you get mad at your friends because they friend request you ever day lol 🤣
1124,1125,2022-08-07,2022,08,07,5,Leonel Khaled,This app is just amazing every time I have a few minutes of free time after work I use this app to to play for a really long time as long as I can it's really fun. I love playing adopt me and all the new pets it's just the beautiful new world look like the view is amazing it's the best app I've ever had
1125,1126,2022-06-18,2022,06,18,4,Shelly Nelson,I love this app so much! But there's something wrong- I leave the tab open for literally 10 secs and it says connecting for 4 mins like what the heck? Also if you try to close the tab then reopen it will glitch(for me) and my screen will freeze and the only way to unfreeze is to turn of your phone or your computer please check this roblox! Thanks 😊
1126,1127,2022-07-27,2022,07,27,4,Kenni Nation,"Roblox is a great game, but the game has some bugs. When you join a game like Brookhaven or Bloxburg or just any game period, your character moves on it's own for a good 5 minutes. It gets really annoying after a while and I have to leave and join back for it to stop doing that. The game also makes me lag alot. When I am on mobile my game tends to kick me out and lags very badly and I just leave and play on my computer because it will not work well. I hope Roblox can fix these issues."
1127,1128,2022-08-17,2022,08,17,5,Carly Wisener,"This is a great game so many characters ect!. ive been playing it for over 2 years now, its really addicting I dont know what I would do without it! You can make freinds and so much more, the only annoying thing is the tags fliter I know its because of bad people and stuff, but please let us atleast say some more? Lol anyways I love this app thanks for creating it."
1128,1129,2022-08-06,2022,08,06,3,Jennifer Therond,Sometimes it bugs and I knock into stuff why can't we just go true the stuff every time and the thing that I don't like sometimes it glitches on me and sometimes they don't do correct and it goes very slowly and the button of 4 when we jumped doesn't work for me Please do it and I will give you 5 stars
1129,1130,2022-07-05,2022,07,05,3,- N o -,"The games good and all, but there is some major issues. The site is incredibly laggy, and I get booted off games often. Moderation is super sensitive and I've gotten banned / warned for the smallest of things. Some things i'd also like to see is increased limit on our about section. I also would like to see at least a small raise on the robux we make from selling clothes or gamepasses. Other than that, the games amazing considering i've been here since early 2018. The improvements are great!"
1130,1131,2022-08-22,2022,08,22,1,Lumen,"This game is terrible, it has trash optimization, runs horribly, slow, laggy, crashes constantly, takes ages to start up, it's completely unbearable. Years ago this game was fun, and it ran well, but now it runs so very poorly. Your 'game' is attrociously bad and needs major fixes."
1131,1132,2022-07-29,2022,07,29,3,cassandra reed,I have issues with this app and when I say issues I mean a lot of issues first is that the thumbstick is tiny on iPad and on Android it usually whenever you have the thingy when instead of having a circle it's that thing but literally every time you move or you you're moving but you click something wrong you zoom in and out you can never move and you cannot look to the left or your right and if you're zoomed in and that's the only thing you can be zoomed in you won't be able to look anywhere
1132,1133,2022-08-02,2022,08,02,4,Isla Gettings,brillient game but i rated it a four star bc sometimes it just kickes u off the game for example when ur in the middle of a role play and it randomly glitches and then kickes u off. Other than that its an AMAZING game good for kids. U might need to change the age rating bc it says it's a twelve plus and somany kids play it. Like i said FANTASTIC game
1133,1134,2022-08-02,2022,08,02,5,MiaFaithPlayz,"Hello people! I am Mia and roblox is the best experience to play! Theres games from murder mysteries to aging up pets to adopting children to minigames! Its so much to even explain like whaaa.. Anyway, first sign in, its easy! Make a username! Anything you imagine!!!! Password next. Again, ANYTHING YOU WISH! As long as its in the limit of characters and if its appropriate. Okay byee have fun!"
1134,1135,2022-06-29,2022,06,29,5,Abdullah Darr,"This game is great ,the only problem is that we need games that work really smooth for 2gm of ram . It lags alot ,but now I'm used ti playing on my laptop so it's not really a problem otherwise this game is great ! Also please remove stitchface because there are too many slenders in the game with stitch face's on there characters . Also please make old roblox sign because I've seen too many people do that on YouTube,otherwise this is a great game ! Also there are too many connection problems."
1135,1136,2022-07-30,2022,07,30,4,Sally Mccollough,"Very, very fun game! Although, like many others, I have the same issue of it only zooming in and out sometimes. Please fix this, it is very agravating. Besides that an amusing experiance."
1136,1137,2022-06-11,2022,06,11,4,Alex,"The app is REALLY FUN, but it upgrades soooooo much! I don't want to upgrade it as much as I do; it's very laggy, especially when you are on samsung mobile. (That is from experience, and I think a lot of people will agree. But I can't play it on my new laptop because it updated to something im not up to yet. ={"
1137,1138,2022-08-18,2022,08,18,5,Nma Mina,"I love this game!!!!!!! You should download this game you can a lot of friends! If you see a green dot press it and you can join your friends! Ther is like 1000,00 of games killer games, tycoon games, quite games, loud games I think. If wannt to see lots of games and play lots of games and play lots of games u should download it!But...there is one problem Today i couldn't chat anymore not in any more so I deleted it i searched but nothing so I had to redownload it so becarefull."
1138,1139,2022-06-27,2022,06,27,4,muhammad afzaal,"Hi,I rate this a 4 star because sometimes the upgrades can be really annoying. If you dont want one then it forces you to get one which I absolutely hate. Although it is a really adventurous and intresting free game! I would recommend this to all my friends. :)"
1139,1140,2022-07-29,2022,07,29,4,kevin banana,"The new roblox oof sound is horrible, roblox could've chosen anything for the new death sound. Out of all of the sounds, they chose the one that goes like ""gah"". That doesn't even sound like a death, and don't get me started on the lawsuit. Because they could've payed for a 2 second sound but chose not to. Please bring back the oof sound and I'll change this review to a five star."
1140,1141,2022-07-01,2022,07,01,5,Isaiah loves fortnite,I really enjoy playing Roblox because it is a game where you can let your mind be creative and wonder into an adventureous playful experience. You really can't get bored playing this game and don't NEED to spend money since most of the games are free and there is a HUGE variety to choose from. This may be a hated game but people really don't get the point. Which is to explore different games and make new hobbies and friends.
1141,1142,2022-07-30,2022,07,30,2,Tasa Ts,the game is alright but the oof sound is really just not how the game raised me and can you please fix the mixing hairs it really helps the avatars and taking it away really does nothing expect making people annoyed please fix the mixing hairs and theirs something called kohl's admin and I would really appreciate you trying to at least fix that but right now my opinion is staying at 2 stars the game isn't the game anymore.
1142,1143,2022-08-11,2022,08,11,5,Emi Duarte,"Definetley has improved. On the android version tho sometimes its stuck on the loading screen but i have an easy solution. Firstly either restart your phone or clear all your tabs and go back to roblox. Hope they patch it. I think why its cause maybe all your tabs might crash your game so yeah. 6:28 PM August 10, 2022"
1143,1144,2022-08-17,2022,08,17,4,Jordan Verheyen,I love this game so much . So many different games on it and you can play with so many friends. The only thing is I wish they had better free clothing for you avatar bc if you can't get robux you might be sad cuz you character looks bad at least one good free hair style. Sometimes the games glitch but it's understandable and it stops. But it's a Greta game none the less
1144,1145,2022-08-03,2022,08,03,4,Shane Sean Lachica,very great game but the problem is 1. the has so much storage and you can maybe fix it by clicking a button that says delete all progress in a one game 2. i hate the bug that your game glitch and your character dont move or when you try to walk the screen moves its just annoying when i do a obby and 3. this Filipinos can relate if your just gonna lang or ang it don't work. it is going to be nice if you fix just one of this -shasean2402
1145,1146,2022-08-23,2022,08,23,5,Harley Messiah,"Roblox is just so addictional becasue there are so many games and updates. I never get board of playing, plus i have been playing since 2015 to 2022. If i'm honest i think that when you start roblox there should be a backstory behind how bacon hair was made. Now, one thing i want in brookhaven is a plane that u can fly. IM going to say this again, roblox is so addictional. Thank you for your time."
1146,1147,2022-07-29,2022,07,29,4,Celeste Williams,"It's a really good game, however, i have only two problems, you can't create games on a mobile device and there a glitch that makes your screen stuck so you that you can't turn, and only zoom in. If you could change these it would make the game absolutely perfect for mobile players! Bring back the oof sound!!"
1147,1148,2022-07-20,2022,07,20,4,Maggie yeet,I love this game but there are a couple things you have to fix like bugs. sometimes I am playing with my friends and I go to join them and it says there offline and I get so mad so I wait like a hour to fix it. Also sometimes when you try to spin around it just zooms you in or out and it you have to leave then rejoin. Other than that I think this is the best game ever I think I have played!
1148,1149,2022-08-13,2022,08,13,3,Susan Bowman,I LOVE THE Game but 3 stars because of the lag and sometimes I have to Uninstall it just to play it.And sometimes when you move the player the camera moves to then I have to rejoin the game. But other than that the game is amazing!
1149,1150,2022-06-25,2022,06,25,5,Roberto and Cherish Behrens,"Sooo many games it's been amazing but there is always bugs that glitch me out off the game im playing its soo annoying! Please fix that. 😩 Other than that its very fun i recommend it as long as your ok with long waits and lots of bugs , also make there a way to get free robux $$$ . I think it's an amazing game tho hope this was helpful! 😁"
1150,1151,2022-07-07,2022,07,07,5,Edobor Joy,"Is a awesome and incredible experience and a opportunity to play with your friends, family and more. I love the idea and way of the creators because, yes, maybe is a game, but you have fun and learn some things. The bad things are the updated, the game is better, but you want to play and you read "" Updated"" in your screen, it is okay, it is still been a great game."
1151,1152,2022-08-15,2022,08,15,5,yeet okie,"This game is so great, it has a ton of games in one, and not to mention you can make games too, and customize your character better with robux. This isn't roblox's fault, but some gamepasses are so expensive, it's over 30 bucks sometimes in cash for something. Overall this game is amazing. The chat is strict because of creative ways people say bad things, I don't blame roblox for it."
1152,1153,2022-07-31,2022,07,31,4,Ahmad Abiru,Roblox is the best. I love how users can make games themselves and hang with their friends. There are tons of games and tons of ways to have fun. My only problem is that the screen glitches randomly and can only zoom in and out.
1153,1154,2022-08-06,2022,08,06,5,Itz Kawaiigirlplayz,"This game so fun !! i really like it , it have many game and have free skins too really love it edit:there a problem,when i was playing in a game it suddenly glitch me out the game i hope you fix it soon Edit:it remove the iconic off sound and replace it with this gah sound that sound like sneeze"
1154,1155,2022-08-07,2022,08,07,5,olfat ayoub,"Love the game! if someone asked me if they should dounloud roblox, then i would immediatly say yes!!! but there are a few things that i dont like. the first one is something alot of people talk about. they talk about the screen glitching and when you try to look arpund, you zoom in and out when you dont want to and the other thing is that i dont like the new oof sound so much so if you could bring the old oof sound back, i would really enjoy it! but TBH, i recomend to dounload roblox, its free!!"
1155,1156,2022-08-07,2022,08,07,4,Elijah Little,"The Games Good, and has a lot of different games you can play! The only complaint I have is that the camera gets stuck pretty much all the time, and I used to be able to fix it by changing the camera mode, but that no longer works either! Anyways pretty ok game."
1156,1157,2022-08-05,2022,08,05,5,Pam Tucker,Well my experience was great sometimes there will be bull's but it depends what game you play. The only thing that i don't like is that it needs updating all the time. Other than that the game is perfect!!😆
1157,1158,2022-08-03,2022,08,03,4,Valerie Malinao,"As a Roblox player for 5 years I really can tell that there's an improvement on this game. But eventually, the lagging thingy is still there, and I want it to be fixed so the other players can experience the game smoothly. It's a good game."
1158,1159,2022-07-29,2022,07,29,4,Lonfefe 246,"Very nice game but still, ban stitchface, toxic people are being created because of it and ruin our time on this platform, also please fix your servers because sometimes it gives me an ID connection in a game and I have to wait till tomorrow, then it says that they can't connect to their servers and then I have to wait another day! Please fix ur servers, but over all, it's very good!"
1159,1160,2022-08-22,2022,08,22,4,Rafael Bancajergan,"Its good and its a nice game that can play by many people it has good and nice quality but, sometimes when I'm playing Roblox its laggy, idk if its just a problem on my phone or problem on internet. But, I highly recommend to play this game, its really good, this is the best game u can play when you're bored or you cant do any, there'a bug sometimes but they can fix it. I only wanna say that please, please delete all account of roblox hackers. Past month, I got hacked but I got my acc back, TY!"
1160,1161,2022-08-20,2022,08,20,4,Khafidzah Lubna,Sksksksks I love this app I can play with friends and can find online friends>\\\< This is the best game in the world!<3 but if I say another language its tag so please update the better than before!and if I get log out I log in with the same account and If I get the pass it isnt work but is it the right pass..and I don't have choice to make a new account:)
1161,1162,2022-06-13,2022,06,13,4,Claire Yang,"This game is very fun, however, when I'm in any game and click the Roblox button at the top left and then exit out of it, I can't look around (I'm on mobile). When I put on 1 finger on the screen and drag to try to look around, it just zooms in and out. It's only supposed to zoom in and out when I put 2 fingers on the screen... So that makes me have to rejoin and it's really annoying"
1162,1163,2022-08-17,2022,08,17,2,Twice Once,"this game was really pretty fun, i've been playing this for a year but suddenly i noticed that something was wrong about this app, it keeps kicking me out of the game and when i tried to play it again, it will kick me out again after 2-5 mins, please fix this, Thank you."
1163,1164,2022-08-11,2022,08,11,5,Sadie,"I love this app alot. It has alot of rping games, fighting games, anime games, ect. all of the games are soooooooo fun. I get to play these games with online friends, friends I acually know, and I get to play by myself ofc! This game also helps people to come out of their shell, and it gets people out of their comfort zone sometimes. You can create games for you and other people to play too! Overal I think this app is really fun, and a little helpful for younger kids."
1164,1165,2022-06-22,2022,06,22,4,Usman Rayan,"This is a really fun game but there are some glitches,like sometimes the screen just start zooming in and out when I look around and there is a game sonic speed simulator,my favorite game I just can't join the game and I can't even leave I have to close the app and re-open it ,so if you can please solve this then it will be amazing and it's a pretty good game."
1165,1166,2022-07-25,2022,07,25,5,Gamer_Fox,"To those who says that they having the same issue which is the zoom in and out thingy, let me tell u that's no reason to give the game a 3 Star rate, it is super amazing that's why I give 5 Star rate. The zoom in and out thingy happens cuz u accidentally click multiple spots at the same time from ur screen causing these to lock the scrolling that's let you see around ur avatar, it can be solved by simply leaving and rejoining the game."
1166,1167,2022-06-13,2022,06,13,5,Gamers Club,I really like this game and I really recommend playing this app but there are several glitches like the camera glitch where you can't move your camera and you have to leave and join back to fix it. Roblox has has many updates with bug fixes but they aren't fixing the most important ones. (Only happens on moblie) but somehow the game isn't bad because of it its actually really good and you should try it!!
1167,1168,2022-08-19,2022,08,19,4,Khushi Pindoria,"I love this game, the reason why I gave it a 4 star is because that after 10 or 5 days of playing, it gets laggy and it's very hard to move while playing on tablet. It works fine on pc but on mobile is it's hard to move around."
1168,1169,2022-08-01,2022,08,01,5,King Gamer20041,"I really really love this game so much and I rate this as a 5 star because it has so many games but here is on small problem and its that when you are playing lots of games it always have to have robux and also some small thing cost so much robux and I dont like that, but everything else is perfect. Thank you for making this app."
1169,1170,2022-08-03,2022,08,03,5,Cemaria J,It really fun there was some glitches but not now and they have a lot of games to play and just the beat game I ever downloaded I really recommend for everyone you can do so much in this app and change your avatar into your favorite style most games or free to play not much to have to pay for again really recommend.
